{
  "$schema": "https://json-schema.org/draft/2020-12/schema",
  "$id": "https://local-rag.dev/fixtures/case-index.schema.json",
  "title": "Fixture case index",
  "description": "Implementation-neutral case list for one fixture family. Each case is input -> expected behavior; never a vector-store payload schema.",
  "type": "object",
  "required": ["family", "version", "cases"],
  "additionalProperties": false,
  "properties": {
    "family": {
      "enum": ["parser", "reconcile", "search", "memory", "adversarial", "fault"]
    },
    "version": { "type": "string", "minLength": 1 },
    "description": { "type": "string" },
    "cases": {
      "type": "array",
      "minItems": 1,
      "items": { "$ref": "#/$defs/case" }
    }
  },
  "$defs": {
    "case": {
      "type": "object",
      "required": ["id", "title", "status", "provenance", "input", "expected"],
      "additionalProperties": false,
      "properties": {
        "id": {
          "type": "string",
          "pattern": "^[a-z0-9]+(?:[._-][a-z0-9]+)*$",
          "description": "Globally unique fixture id across all families."
        },
        "title": { "type": "string", "minLength": 1 },
        "status": {
          "enum": ["active", "deferred"],
          "description": "active = v0 expected behavior; deferred = kept for reference, not a v0 gate (15 §3)."
        },
        "tags": { "type": "array", "items": { "type": "string" } },
        "provenance": { "$ref": "#/$defs/provenance" },
        "input": {
          "type": "object",
          "description": "Neutral input: tree / event / query / request. May embed a declarative tree or reference input_path."
        },
        "expected": {
          "type": "object",
          "description": "Observable expected behavior/outcome. No internal payload field names."
        }
      }
    },
    "provenance": {
      "type": "object",
      "required": ["source"],
      "additionalProperties": false,
      "properties": {
        "source": { "type": "string", "minLength": 1, "description": "v1 file the assertion was imported from." },
        "ref": { "type": "string", "description": "Test name / describe block / line hint in the source." },
        "note": { "type": "string" }
      }
    }
  }
}
